Title	Link	Category	Image	Excerpt
N/A	N/A	N/A	N/A	N/A
N/A	N/A	N/A	N/A	N/A
Comment bien choisir sa gouttière : 5 conseils essentiels5 raisons de choisir une entreprise RGEQuelles sont les pierres naturelles à éviter durant le sommeil ?Laser Game Tours : vers où se diriger ?Quelles sont les démarches à faire quand on déménage ?Quels jeux pour un enfant de deux ans ?Comment fonctionne le recyclage de mégots ?Décoration de bureau professionnel : pourquoi est-ce important ?Quand changer le liquide caloporteur ?Comment se passe une procédure de divorce accepté pour faute sur Compiègne ?Qu’est-ce qu’une palette non gerbable ?5 anecdotes sur les animaux sauvages !Vapotage et assurance vie : comment ça se passe ?Comment dormir après une mastectomie ?Comment faire une chasse au trésor réussie ?Tout savoir sur le superbe chat Sacré de Birmanie !Qui rembourse les frais de serrurier ?Spectacle de drones : comment ça marche ?Est-ce que le CBD aide à dormir ?Quel est le caractère du Chat Birman ?Nourriture : quelles précautions pour son chien malade ?Qu’est-ce que la location-vente immobilière ?Qu’est-ce qu’une baie vitrée à galandage ?Peut-on emprunter et inclure des travaux ?	https://www.flashinfo.fr/choisir-gouttiere-5-conseils-essentiels.html	HabitationEntrepriseVie PratiqueLoisirsHabitationVie PratiqueVie PratiqueEntrepriseEntrepriseVie PratiqueVie PratiqueLoisirsVie PratiqueVie PratiqueLoisirsLoisirsHabitationVie PratiqueVie PratiqueLoisirsVie PratiqueVie PratiqueHabitationHabitation	https://www.flashinfo.fr/wp-content/uploads/2025/07/demenagement-reims-414x276.png	S’il existe une foule de solutions à mettre en place pour un déménagement sans stress, impossible de faire l’impasse sur les démarches administratives. Il est...Comment être certain de faire plaisir à un enfant de 2 ans ? Il est sûr que la question est importante si l’on est sur le point de faire un cadeau à l’un d’eux...Recycler des mégots ? Voilà une idée qui semble bien saugrenue, quand on considère ce détritus, jeté là, de manière négligente sur le trottoir. Cependant, tous...Vous souhaitez décorer les bureaux de votre entreprise, mais ne savez pas vers quelle solution vous tourner ? Pour une décoration de bureau professionnel...Le liquide caloporteur suppose ; comme son nom l’indique ; de véhiculer de l’air chaud d’un endroit à un autre, généralement par le biais d’un appareil de type...Lors d’un mariage, l’un des deux époux peut reprocher à l’autre des manquements ou des actes qui ont rendu la vie de couple intolérable. Dans ce cas, quand on...Le fait de devoir entreposer de grandes quantités de marchandises doit orienter un professionnel vers un certain type de palettes. Dans ce cadre, il est...Les animaux sauvages peuplent notre planète depuis des millions d’années. Ils fascinent les observateurs avec leur comportement étonnant et leurs...Lorsque l’on décide de passer à la cigarette électronique, notamment pour se sevrer du tabac traditionnel, on ne pense pas à son assurance vie. Mais il...Si la vie est forcément bouleversée par un cancer du sein, on peut aussi se poser des questions plus pratiques et pragmatiques, sur son sommeil par exemple...Une chasse au trésor, ce sont en général des indices à trouver ou des énigmes à résoudre, pour à la fin, trouver un trésor. Si cette activité plait toujours...A mi-chemin entre le persan et le siamois, le sacré de Birmanie appelé aussi birman est calme et doux, quoiqu’un brin réservé. Il affiche une personnalité...La porte d’entrée est censée représenter le barrage idéal contre les intrusions importunes. Pourtant, les chiffres et les constats du cambriolage en France...Il y a de plus en plus de spectacles de drones dans les lieux touristiques. Leur extrême manœuvrabilité, leur programmation totale, les jeux de lumières et...L’expérience d’utilisateurs de plus en plus nombreux permet de mettre en avant les atouts indéniables de la consommation de CBD, sous forme d’huile par...Contrairement à ce que son nom le suggère, le chat birman ou sacré de Birmanie ne vient pas de Birmanie. Cette race de chat est d’origine française et issue...Si l’alimentation est essentielle pour garder son animal de compagnie en bonne santé, elle l’est d’autant plus lorsque le chien est malade. Qu’il s’agisse...L’acquisition immobilière peut s’effectuer de mille et une façons. Une des méthodes comme tant d’autres consiste à faire une location-vente. Cette formule de...Mettre des baies vitrées semble désormais une évidence pour maximiser l’apport de lumière, mais aussi avoir vue sur son jardin ou sa terrasse. Pourtant, il...Pour certains futurs propriétaires, impossible d’imaginer faire bâtir. Ils veulent une maison avec du cachet et une histoire, même si cela suppose devoir faire...
Comment bien choisir sa gouttière : 5 conseils essentiels5 raisons de choisir une entreprise RGEQuelles sont les pierres naturelles à éviter durant le sommeil ?Laser Game Tours : vers où se diriger ?Quelles sont les démarches à faire quand on déménage ?Quels jeux pour un enfant de deux ans ?Comment fonctionne le recyclage de mégots ?Décoration de bureau professionnel : pourquoi est-ce important ?Quand changer le liquide caloporteur ?Comment se passe une procédure de divorce accepté pour faute sur Compiègne ?Qu’est-ce qu’une palette non gerbable ?5 anecdotes sur les animaux sauvages !Vapotage et assurance vie : comment ça se passe ?Comment dormir après une mastectomie ?Comment faire une chasse au trésor réussie ?Tout savoir sur le superbe chat Sacré de Birmanie !Qui rembourse les frais de serrurier ?Spectacle de drones : comment ça marche ?Est-ce que le CBD aide à dormir ?Quel est le caractère du Chat Birman ?Nourriture : quelles précautions pour son chien malade ?Qu’est-ce que la location-vente immobilière ?Qu’est-ce qu’une baie vitrée à galandage ?Peut-on emprunter et inclure des travaux ?	https://www.flashinfo.fr/choisir-gouttiere-5-conseils-essentiels.html	HabitationEntrepriseVie PratiqueLoisirsHabitationVie PratiqueVie PratiqueEntrepriseEntrepriseVie PratiqueVie PratiqueLoisirsVie PratiqueVie PratiqueLoisirsLoisirsHabitationVie PratiqueVie PratiqueLoisirsVie PratiqueVie PratiqueHabitationHabitation	https://www.flashinfo.fr/wp-content/uploads/2025/07/demenagement-reims-414x276.png	S’il existe une foule de solutions à mettre en place pour un déménagement sans stress, impossible de faire l’impasse sur les démarches administratives. Il est...Comment être certain de faire plaisir à un enfant de 2 ans ? Il est sûr que la question est importante si l’on est sur le point de faire un cadeau à l’un d’eux...Recycler des mégots ? Voilà une idée qui semble bien saugrenue, quand on considère ce détritus, jeté là, de manière négligente sur le trottoir. Cependant, tous...Vous souhaitez décorer les bureaux de votre entreprise, mais ne savez pas vers quelle solution vous tourner ? Pour une décoration de bureau professionnel...Le liquide caloporteur suppose ; comme son nom l’indique ; de véhiculer de l’air chaud d’un endroit à un autre, généralement par le biais d’un appareil de type...Lors d’un mariage, l’un des deux époux peut reprocher à l’autre des manquements ou des actes qui ont rendu la vie de couple intolérable. Dans ce cas, quand on...Le fait de devoir entreposer de grandes quantités de marchandises doit orienter un professionnel vers un certain type de palettes. Dans ce cadre, il est...Les animaux sauvages peuplent notre planète depuis des millions d’années. Ils fascinent les observateurs avec leur comportement étonnant et leurs...Lorsque l’on décide de passer à la cigarette électronique, notamment pour se sevrer du tabac traditionnel, on ne pense pas à son assurance vie. Mais il...Si la vie est forcément bouleversée par un cancer du sein, on peut aussi se poser des questions plus pratiques et pragmatiques, sur son sommeil par exemple...Une chasse au trésor, ce sont en général des indices à trouver ou des énigmes à résoudre, pour à la fin, trouver un trésor. Si cette activité plait toujours...A mi-chemin entre le persan et le siamois, le sacré de Birmanie appelé aussi birman est calme et doux, quoiqu’un brin réservé. Il affiche une personnalité...La porte d’entrée est censée représenter le barrage idéal contre les intrusions importunes. Pourtant, les chiffres et les constats du cambriolage en France...Il y a de plus en plus de spectacles de drones dans les lieux touristiques. Leur extrême manœuvrabilité, leur programmation totale, les jeux de lumières et...L’expérience d’utilisateurs de plus en plus nombreux permet de mettre en avant les atouts indéniables de la consommation de CBD, sous forme d’huile par...Contrairement à ce que son nom le suggère, le chat birman ou sacré de Birmanie ne vient pas de Birmanie. Cette race de chat est d’origine française et issue...Si l’alimentation est essentielle pour garder son animal de compagnie en bonne santé, elle l’est d’autant plus lorsque le chien est malade. Qu’il s’agisse...L’acquisition immobilière peut s’effectuer de mille et une façons. Une des méthodes comme tant d’autres consiste à faire une location-vente. Cette formule de...Mettre des baies vitrées semble désormais une évidence pour maximiser l’apport de lumière, mais aussi avoir vue sur son jardin ou sa terrasse. Pourtant, il...Pour certains futurs propriétaires, impossible d’imaginer faire bâtir. Ils veulent une maison avec du cachet et une histoire, même si cela suppose devoir faire...
Comment bien choisir sa gouttière : 5 conseils essentiels5 raisons de choisir une entreprise RGEQuelles sont les pierres naturelles à éviter durant le sommeil ?Laser Game Tours : vers où se diriger ?	https://www.flashinfo.fr/choisir-gouttiere-5-conseils-essentiels.html	HabitationEntrepriseVie PratiqueLoisirs	N/A	N/A
Quelles sont les démarches à faire quand on déménage ?Quels jeux pour un enfant de deux ans ?Comment fonctionne le recyclage de mégots ?Décoration de bureau professionnel : pourquoi est-ce important ?Quand changer le liquide caloporteur ?Comment se passe une procédure de divorce accepté pour faute sur Compiègne ?Qu’est-ce qu’une palette non gerbable ?5 anecdotes sur les animaux sauvages !Vapotage et assurance vie : comment ça se passe ?Comment dormir après une mastectomie ?Comment faire une chasse au trésor réussie ?Tout savoir sur le superbe chat Sacré de Birmanie !Qui rembourse les frais de serrurier ?Spectacle de drones : comment ça marche ?Est-ce que le CBD aide à dormir ?Quel est le caractère du Chat Birman ?Nourriture : quelles précautions pour son chien malade ?Qu’est-ce que la location-vente immobilière ?Qu’est-ce qu’une baie vitrée à galandage ?Peut-on emprunter et inclure des travaux ?	https://www.flashinfo.fr/demarches-faire-quand-demenage.html	HabitationVie PratiqueVie PratiqueEntrepriseEntrepriseVie PratiqueVie PratiqueLoisirsVie PratiqueVie PratiqueLoisirsLoisirsHabitationVie PratiqueVie PratiqueLoisirsVie PratiqueVie PratiqueHabitationHabitation	https://www.flashinfo.fr/wp-content/uploads/2025/07/demenagement-reims-414x276.png	S’il existe une foule de solutions à mettre en place pour un déménagement sans stress, impossible de faire l’impasse sur les démarches administratives. Il est...Comment être certain de faire plaisir à un enfant de 2 ans ? Il est sûr que la question est importante si l’on est sur le point de faire un cadeau à l’un d’eux...Recycler des mégots ? Voilà une idée qui semble bien saugrenue, quand on considère ce détritus, jeté là, de manière négligente sur le trottoir. Cependant, tous...Vous souhaitez décorer les bureaux de votre entreprise, mais ne savez pas vers quelle solution vous tourner ? Pour une décoration de bureau professionnel...Le liquide caloporteur suppose ; comme son nom l’indique ; de véhiculer de l’air chaud d’un endroit à un autre, généralement par le biais d’un appareil de type...Lors d’un mariage, l’un des deux époux peut reprocher à l’autre des manquements ou des actes qui ont rendu la vie de couple intolérable. Dans ce cas, quand on...Le fait de devoir entreposer de grandes quantités de marchandises doit orienter un professionnel vers un certain type de palettes. Dans ce cadre, il est...Les animaux sauvages peuplent notre planète depuis des millions d’années. Ils fascinent les observateurs avec leur comportement étonnant et leurs...Lorsque l’on décide de passer à la cigarette électronique, notamment pour se sevrer du tabac traditionnel, on ne pense pas à son assurance vie. Mais il...Si la vie est forcément bouleversée par un cancer du sein, on peut aussi se poser des questions plus pratiques et pragmatiques, sur son sommeil par exemple...Une chasse au trésor, ce sont en général des indices à trouver ou des énigmes à résoudre, pour à la fin, trouver un trésor. Si cette activité plait toujours...A mi-chemin entre le persan et le siamois, le sacré de Birmanie appelé aussi birman est calme et doux, quoiqu’un brin réservé. Il affiche une personnalité...La porte d’entrée est censée représenter le barrage idéal contre les intrusions importunes. Pourtant, les chiffres et les constats du cambriolage en France...Il y a de plus en plus de spectacles de drones dans les lieux touristiques. Leur extrême manœuvrabilité, leur programmation totale, les jeux de lumières et...L’expérience d’utilisateurs de plus en plus nombreux permet de mettre en avant les atouts indéniables de la consommation de CBD, sous forme d’huile par...Contrairement à ce que son nom le suggère, le chat birman ou sacré de Birmanie ne vient pas de Birmanie. Cette race de chat est d’origine française et issue...Si l’alimentation est essentielle pour garder son animal de compagnie en bonne santé, elle l’est d’autant plus lorsque le chien est malade. Qu’il s’agisse...L’acquisition immobilière peut s’effectuer de mille et une façons. Une des méthodes comme tant d’autres consiste à faire une location-vente. Cette formule de...Mettre des baies vitrées semble désormais une évidence pour maximiser l’apport de lumière, mais aussi avoir vue sur son jardin ou sa terrasse. Pourtant, il...Pour certains futurs propriétaires, impossible d’imaginer faire bâtir. Ils veulent une maison avec du cachet et une histoire, même si cela suppose devoir faire...
Quelles sont les démarches à faire quand on déménage ?	https://www.flashinfo.fr/demarches-faire-quand-demenage.html	Habitation	https://www.flashinfo.fr/wp-content/uploads/2025/07/demenagement-reims-414x276.png	S’il existe une foule de solutions à mettre en place pour un déménagement sans stress, impossible de faire l’impasse sur les démarches administratives. Il est...
Quels jeux pour un enfant de deux ans ?	https://www.flashinfo.fr/jeux-enfant-deux-ans.html	Vie Pratique	https://www.flashinfo.fr/wp-content/uploads/2025/05/jeux-enfants-3ans-414x276.jpg	Comment être certain de faire plaisir à un enfant de 2 ans ? Il est sûr que la question est importante si l’on est sur le point de faire un cadeau à l’un d’eux...
Comment fonctionne le recyclage de mégots ?	https://www.flashinfo.fr/fonctionne-recyclage-megots.html	Vie Pratique	https://www.flashinfo.fr/wp-content/uploads/2025/03/fonctionne-collecte-des-megots-414x276.png	Recycler des mégots ? Voilà une idée qui semble bien saugrenue, quand on considère ce détritus, jeté là, de manière négligente sur le trottoir. Cependant, tous...
Décoration de bureau professionnel : pourquoi est-ce important ?	https://www.flashinfo.fr/decoration-bureau-professionnel.html	Entreprise	https://www.flashinfo.fr/wp-content/uploads/2025/02/deco-bureau-pro-414x276.png	Vous souhaitez décorer les bureaux de votre entreprise, mais ne savez pas vers quelle solution vous tourner ? Pour une décoration de bureau professionnel...
Quand changer le liquide caloporteur ?	https://www.flashinfo.fr/quand-changer-le-liquide-caloporteur.html	Entreprise	https://www.flashinfo.fr/wp-content/uploads/2024/12/echangeur-thermique-industrie-414x276.jpeg	Le liquide caloporteur suppose ; comme son nom l’indique ; de véhiculer de l’air chaud d’un endroit à un autre, généralement par le biais d’un appareil de type...
Comment se passe une procédure de divorce accepté pour faute sur Compiègne ?	https://www.flashinfo.fr/procedure-divorce-accepte-faute-compiegne.html	Vie Pratique	https://www.flashinfo.fr/wp-content/uploads/2024/06/procedure-divorce-accepte-faute-compiegne-414x276.jpeg	Lors d’un mariage, l’un des deux époux peut reprocher à l’autre des manquements ou des actes qui ont rendu la vie de couple intolérable. Dans ce cas, quand on...
Qu’est-ce qu’une palette non gerbable ?	https://www.flashinfo.fr/palette-non-gerbable.html	Vie Pratique	https://www.flashinfo.fr/wp-content/uploads/2024/05/palette-non-gerbable-1-414x276.jpeg	Le fait de devoir entreposer de grandes quantités de marchandises doit orienter un professionnel vers un certain type de palettes. Dans ce cadre, il est...
5 anecdotes sur les animaux sauvages !	https://www.flashinfo.fr/5-anecdotes-animaux-sauvages.html	Loisirs	https://www.flashinfo.fr/wp-content/uploads/2024/02/5-anecdotes-animaux-sauvages-414x276.jpg	Les animaux sauvages peuplent notre planète depuis des millions d’années. Ils fascinent les observateurs avec leur comportement étonnant et leurs...
Vapotage et assurance vie : comment ça se passe ?	https://www.flashinfo.fr/vapotage-assurance-vie.html	Vie Pratique	https://www.flashinfo.fr/wp-content/uploads/2024/02/vapotage-assurance-vie-414x276.jpeg	Lorsque l’on décide de passer à la cigarette électronique, notamment pour se sevrer du tabac traditionnel, on ne pense pas à son assurance vie. Mais il...
Comment dormir après une mastectomie ?	https://www.flashinfo.fr/dormir-apres-mastectomie.html	Vie Pratique	https://www.flashinfo.fr/wp-content/uploads/2023/07/dormir-apres-mastectomie-414x276.jpeg	Si la vie est forcément bouleversée par un cancer du sein, on peut aussi se poser des questions plus pratiques et pragmatiques, sur son sommeil par exemple...
Comment faire une chasse au trésor réussie ?	https://www.flashinfo.fr/chasse-au-tresor-reussie.html	Loisirs	https://www.flashinfo.fr/wp-content/uploads/2023/05/AdobeStock_145943784-414x276.jpeg	Une chasse au trésor, ce sont en général des indices à trouver ou des énigmes à résoudre, pour à la fin, trouver un trésor. Si cette activité plait toujours...
Tout savoir sur le superbe chat Sacré de Birmanie !	https://www.flashinfo.fr/superbe-chat-sacre-de-birmanie.html	Loisirs	https://www.flashinfo.fr/wp-content/uploads/2023/04/superbe-chat-sacre-de-birmanie-414x276.png	A mi-chemin entre le persan et le siamois, le sacré de Birmanie appelé aussi birman est calme et doux, quoiqu’un brin réservé. Il affiche une personnalité...
Qui rembourse les frais de serrurier ?	https://www.flashinfo.fr/remboursement-frais-serrurier.html	Habitation	https://www.flashinfo.fr/wp-content/uploads/2023/04/AdobeStock_123964461-414x276.jpeg	La porte d’entrée est censée représenter le barrage idéal contre les intrusions importunes. Pourtant, les chiffres et les constats du cambriolage en France...
Spectacle de drones : comment ça marche ?	https://www.flashinfo.fr/spectacle-drones.html	Vie Pratique	https://www.flashinfo.fr/wp-content/uploads/2023/03/AdobeStock_230711405-414x276.jpeg	Il y a de plus en plus de spectacles de drones dans les lieux touristiques. Leur extrême manœuvrabilité, leur programmation totale, les jeux de lumières et...
Est-ce que le CBD aide à dormir ?	https://www.flashinfo.fr/cbd-aide-dormir.html	Vie Pratique	https://www.flashinfo.fr/wp-content/uploads/2022/11/flacon-huil-cbd-414x276.jpeg	L’expérience d’utilisateurs de plus en plus nombreux permet de mettre en avant les atouts indéniables de la consommation de CBD, sous forme d’huile par...
Quel est le caractère du Chat Birman ?	https://www.flashinfo.fr/caractere-chat-birman.html	Loisirs	https://www.flashinfo.fr/wp-content/uploads/2022/09/caractere-chat-birman-414x276.jpg	Contrairement à ce que son nom le suggère, le chat birman ou sacré de Birmanie ne vient pas de Birmanie. Cette race de chat est d’origine française et issue...
Nourriture : quelles précautions pour son chien malade ?	https://www.flashinfo.fr/nourriture-quelles-precautions-pour-son-chien-malade.html	Vie Pratique	https://www.flashinfo.fr/wp-content/uploads/2022/06/nourriture-quelles-precautions-pour-son-chien-malade-414x276.jpg	Si l’alimentation est essentielle pour garder son animal de compagnie en bonne santé, elle l’est d’autant plus lorsque le chien est malade. Qu’il s’agisse...
Qu’est-ce que la location-vente immobilière ?	https://www.flashinfo.fr/location-vente-immobiliere.html	Vie Pratique	https://www.flashinfo.fr/wp-content/uploads/2022/06/location-vente-immobiliere-414x276.jpg	L’acquisition immobilière peut s’effectuer de mille et une façons. Une des méthodes comme tant d’autres consiste à faire une location-vente. Cette formule de...
Qu’est-ce qu’une baie vitrée à galandage ?	https://www.flashinfo.fr/baie-vitree-galandage.html	Habitation	https://www.flashinfo.fr/wp-content/uploads/2022/03/baie-vitree-414x276.jpg	Mettre des baies vitrées semble désormais une évidence pour maximiser l’apport de lumière, mais aussi avoir vue sur son jardin ou sa terrasse. Pourtant, il...
Peut-on emprunter et inclure des travaux ?	https://www.flashinfo.fr/emprunter-inclure-travaux.html	Habitation	https://www.flashinfo.fr/wp-content/uploads/2022/02/travaux-maison-414x276.jpg	Pour certains futurs propriétaires, impossible d’imaginer faire bâtir. Ils veulent une maison avec du cachet et une histoire, même si cela suppose devoir faire...
N/A	N/A	N/A	N/A	N/A
